{
  "schema": "appsec-review/scan-coverage/1.0",
  "run_id": "20260920T120000Z-v03abc",
  "job_id": "02-mobile-sast",
  "attempt_id": "20260920T120502Z-d4e5f6",
  "source_snapshot_sha256": "sha256:16a0eeb0791b6c92451fd284dd9f599e0a7dbe7f6ebea6e2d2d06c7f74aec112",
  "tools": [
    {
      "tool_id": "mobsfscan-android",
      "applicability": "not-applicable-no-matching-inputs",
      "candidate_input_count": 0,
      "analyzed_input_count": 0,
      "not_analyzed_input_count": 0,
      "unsupported_input_count": 0,
      "not_analyzed_inputs": [],
      "unsupported_inputs": [],
      "input_lists_truncated": false
    },
    {
      "tool_id": "mobsfscan-ios",
      "applicability": "not-applicable-no-matching-inputs",
      "candidate_input_count": 0,
      "analyzed_input_count": 0,
      "not_analyzed_input_count": 0,
      "unsupported_input_count": 0,
      "not_analyzed_inputs": [],
      "unsupported_inputs": [],
      "input_lists_truncated": false
    }
  ],
  "gaps": []
}
